<?xml version="1.0" encoding="utf-8"?>
<sifSpecificationGeneratorConfig
	xmlns="http://www.sifassociation.org/sifSpecificationGenerator/1.0"
	xmlns:xsi="http://www.w3.org/2001/XMLSchema-instance"
	xsi:schemaLocation="http://www.sifassociation.org/sifSpecificationGenerator/1.0  sifSpecificationGeneratorConfig.xsd">
	
	<globalSettings>
		<inputDocument>SIF_DataModel.xml</inputDocument>
		<sifNamespace>http://www.sifassociation.org/datamodel/nz/3.0</sifNamespace>
		<localizationCode>nz</localizationCode>
		<schemaVersion>3.0 (draft 6)</schemaVersion>
		<jsonExamplesXslt>98_Xslt/xmlToJson.xsl</jsonExamplesXslt>
		<resolveExtensions>true</resolveExtensions>
		<isDraft>true</isDraft>
		<documentEnumerationsCompletely>true</documentEnumerationsCompletely>
		<defaultExample>JSON</defaultExample>
	</globalSettings>
	
	<htmlDocuments>
	
		<!-- document 1: many documents-->
		<htmlDocument>
			<singleDocument>false</singleDocument>
			<rootDocumentFileName>index.html</rootDocumentFileName>
			<rootTitle>SIF Implementation Specification (New Zealand) 3.0</rootTitle>
			<documentType>DataModel</documentType>
		</htmlDocument>
		
		<!-- document 2: Single document-->
		<htmlDocument>
			<singleDocument>true</singleDocument>
			<rootDocumentFileName>ImplementationSpecification.html</rootDocumentFileName>
			<rootTitle>SIF Implementation Specification (New Zealand) 3.0</rootTitle>
			<documentType>DataModel</documentType>
		</htmlDocument>
		
	</htmlDocuments>
	
  
	<xsdDocuments>
	
		<xsdDocument>
			<xsdTitle>SIF_MessageNoIncludes</xsdTitle>
			<diagram>true</diagram>
			<isDataModelXsd>false</isDataModelXsd>
			<singleSchema>true</singleSchema>
			<annotate>false</annotate>
			<listWithKeyConstraints>false</listWithKeyConstraints>
			<isSifMessage2Xsd>false</isSifMessage2Xsd>
		</xsdDocument>
		
		<xsdDocument>
			<xsdTitle>SIF_MessageNoIncludesAnnotated</xsdTitle>
			<diagram>false</diagram>
			<isDataModelXsd>false</isDataModelXsd>
			<singleSchema>true</singleSchema>
			<annotate>true</annotate>
			<listWithKeyConstraints>false</listWithKeyConstraints>
			<isSifMessage2Xsd>false</isSifMessage2Xsd>
		</xsdDocument>
		
		<xsdDocument>
			<xsdTitle>SIF_Message</xsdTitle>
			<diagram>false</diagram>
			<isDataModelXsd>false</isDataModelXsd>
			<singleSchema>false</singleSchema>
			<annotate>false</annotate>
			<listWithKeyConstraints>false</listWithKeyConstraints>
			<isSifMessage2Xsd>false</isSifMessage2Xsd>
		</xsdDocument>
		
		<xsdDocument>
			<xsdTitle>SIF_MessageAnnotated</xsdTitle>
			<diagram>false</diagram>
			<isDataModelXsd>false</isDataModelXsd>
			<singleSchema>false</singleSchema>
			<annotate>true</annotate>
			<listWithKeyConstraints>false</listWithKeyConstraints>
			<isSifMessage2Xsd>false</isSifMessage2Xsd>
		</xsdDocument>
		
		<xsdDocument>
			<xsdTitle>DataModelNoIncludes</xsdTitle>
			<diagram>false</diagram>
			<isDataModelXsd>true</isDataModelXsd>
			<singleSchema>true</singleSchema>
			<annotate>false</annotate>
			<listWithKeyConstraints>false</listWithKeyConstraints>
			<isSifMessage2Xsd>false</isSifMessage2Xsd>
		</xsdDocument>
		
		<xsdDocument>
			<xsdTitle>DataModelNoIncludesAnnotated</xsdTitle>
			<diagram>false</diagram>
			<isDataModelXsd>true</isDataModelXsd>
			<singleSchema>true</singleSchema>
			<annotate>true</annotate>
			<listWithKeyConstraints>false</listWithKeyConstraints>
			<isSifMessage2Xsd>false</isSifMessage2Xsd>
		</xsdDocument>
		
		<xsdDocument>
			<xsdTitle>DataModel</xsdTitle>
			<diagram>false</diagram>
			<isDataModelXsd>true</isDataModelXsd>
			<singleSchema>false</singleSchema>
			<annotate>false</annotate>
			<listWithKeyConstraints>false</listWithKeyConstraints>
			<isSifMessage2Xsd>false</isSifMessage2Xsd>
		</xsdDocument>
		
		<xsdDocument>
			<xsdTitle>DataModelAnnotated</xsdTitle>
			<diagram>false</diagram>
			<isDataModelXsd>true</isDataModelXsd>
			<singleSchema>false</singleSchema>
			<annotate>true</annotate>
			<listWithKeyConstraints>false</listWithKeyConstraints>
			<isSifMessage2Xsd>false</isSifMessage2Xsd>
		</xsdDocument>		
	</xsdDocuments>

	
	<!-- Other outputs built using XSLT -->
	<xsltTransformations>
		<xsltTransformation>
			<xsltInputFile>98_Xslt\dmToJsonSchema.xsl</xsltInputFile>

			<xsltOutputDir>JSON</xsltOutputDir>
			<xsltOutputFile>jsonSchema.yaml</xsltOutputFile>
			<yamlToJson>true</yamlToJson>
		</xsltTransformation>

<!-- 
	Not doing Swagger output; Swagger now supports OpenAPI well enough

		<xsltTransformation>
			<xsltInputFile>98_Xslt\dmToSwagger.xsl</xsltInputFile>

			<xsltOutputDir>JSON</xsltOutputDir>
			<xsltOutputFile>swagger.yaml</xsltOutputFile>
			<yamlToJson>true</yamlToJson>
		</xsltTransformation>		
-->
		<xsltTransformation>
			<xsltInputFile>98_Xslt\dmToOpenAPI.xsl</xsltInputFile>

			<xsltOutputDir>JSON</xsltOutputDir>
			<xsltOutputFile>OpenAPI.yaml</xsltOutputFile>
			<yamlToJson>true</yamlToJson>
		</xsltTransformation>		
	</xsltTransformations>
</sifSpecificationGeneratorConfig>
